title,description,funds,start,end,s.duration,eval date,evaluation,exec id,super id,eval id ,org,prog
honey bee hymenoptera venom,elit sodales scelerisque mauris sit amet eros suspendisse accumsan tortor,958356,8/17/19,3/23/27,2,3/4/18,5,1,1,1,Klein Inc,Jared's Pepperweed
Clindamycin in 5 Percent Dextrose,vivamus vel nulla eget eros elementum pellentesque quisque porta volutpat erat quisque erat eros viverra eget,438760,3/21/03,5/17/04,1,3/2/04,9,2,2,2,"Rowe, Crist and Beier",Bluejoint
XEROSTOM,malesuada in imperdiet et commodo vulputate justo in blandit ultrices enim lorem ipsum dolor sit amet consectetuer adipiscing elit proin,813608,6/19/20,8/8/24,3,11/24/19,10,3,3,1,Klein Inc,American Beachgrass
Halcion,bibendum morbi non quam nec dui luctus rutrum nulla tellus in,460197,7/25/12,12/12/19,0,2/17/07,0,4,4,2,"Rowe, Crist and Beier",San Carlos Buckwheat
Etomidate,vel ipsum praesent blandit lacinia erat vestibulum sed magna at nunc commodo placerat praesent,909993,12/29/17,7/23/24,2,7/18/19,10,5,5,1,Klein Inc,Charming Centaury
Stila Hydrating Primer Oil-Free SPF 30,nisi vulputate nonummy maecenas tincidunt lacus at velit vivamus vel nulla eget eros elementum pellentesque quisque porta,166984,1/9/19,4/25/22,1,10/17/21,0,6,6,2,"Rowe, Crist and Beier",Chisos Mountain Crested Coralroot
Softlips Peach Mango,pede ac diam cras pellentesque volutpat dui maecenas tristique est et,810004,6/22/17,10/14/19,2,1/9/18,10,7,7,1,Klein Inc,Canadian White Violet
Levofloxacin,vulputate elementum nullam varius nulla facilisi cras non velit nec nisi vulputate nonummy maecenas tincidunt lacus,276677,8/7/01,8/22/05,0,1/10/04,10,8,8,2,"Rowe, Crist and Beier",Lycianthes
TLB-Matrix,posuere cubilia curae duis faucibus accumsan odio curabitur convallis duis consequat dui nec nisi volutpat eleifend donec,868566,2/15/11,6/4/14,1,8/12/11,7,9,9,1,Klein Inc,Largeflower Tickseed
Leeks,morbi ut odio cras mi pede malesuada in imperdiet et commodo vulputate,424892,3/27/01,9/7/23,0,7/8/05,10,10,10,2,"Rowe, Crist and Beier",Hemp Agrimony
Vancomycin Hydrochloride,platea dictumst maecenas ut massa quis augue luctus tincidunt nulla mollis,418070,11/1/03,2/20/10,2,7/2/09,9,1,1,1,Klein Inc,Tehachapi Ragwort
Pain Relief PM,leo pellentesque ultrices mattis odio donec vitae nisi nam ultrices libero non mattis pulvinar nulla pede ullamcorper augue,546606,1/9/18,6/29/23,3,12/29/21,9,2,2,2,"Rowe, Crist and Beier",Prairie Gentian
LACTULOSE,justo morbi ut odio cras mi pede malesuada in imperdiet et commodo vulputate justo,434938,5/25/13,7/21/19,1,1/21/16,4,3,3,1,Klein Inc,Suksdorf's Buttercup
Proparacaine Hydrochloride,ultrices posuere cubilia curae nulla dapibus dolor vel est donec,884549,3/21/20,10/25/27,2,12/10/20,6,4,4,2,"Rowe, Crist and Beier",Coastal Wattle
METHADONE HYDROCHLORIDE,pede morbi porttitor lorem id ligula suspendisse ornare consequat lectus in est,499193,11/28/16,10/6/21,4,11/6/17,0,5,5,1,Klein Inc,Sierra Woodrush
WHITE LAVENDER AND MINT ANTIBACTERIAL MOISTURIZING HAND SP,quis orci nullam molestie nibh in lectus pellentesque at nulla suspendisse potenti cras in purus eu magna,601962,4/9/15,6/4/16,1,3/26/16,9,6,6,2,"Rowe, Crist and Beier",Straight Bladderpod
Tecfidera,orci luctus et ultrices posuere cubilia curae nulla dapibus dolor vel est donec odio justo sollicitudin,351760,3/22/02,8/13/05,3,11/21/04,8,7,7,1,Klein Inc,Oracle Oak
Cefepime,imperdiet nullam orci pede venenatis non sodales sed tincidunt eu felis fusce posuere felis sed lacus morbi sem mauris,669594,11/4/21,11/21/27,4,1/6/22,9,8,8,2,"Rowe, Crist and Beier",Sphagnum
Enalapril Maleate,cubilia curae mauris viverra diam vitae quam suspendisse potenti nullam porttitor lacus at turpis donec posuere,589991,10/31/05,2/12/15,4,1/12/12,7,9,9,11,Aufderhar Inc,Locoto
Endometrin,tristique in tempus sit amet sem fusce consequat nulla nisl nunc nisl duis bibendum felis sed,932425,10/8/11,3/17/16,1,11/8/15,6,10,10,12,"Hammes, Friesen and Vandervort",New Mexico Goosefoot
Olay Fresh Effects Soak Up the Sun Protection,amet turpis elementum ligula vehicula consequat morbi a ipsum integer a nibh in quis,689462,10/6/15,3/27/25,2,12/19/16,1,1,1,13,"Ortiz, Dietrich and Blanda",Ambrosia Leaf Bur Ragweed
Fanapt,turpis sed ante vivamus tortor duis mattis egestas metus aenean,244556,6/23/03,3/22/18,0,12/5/10,5,2,2,11,Aufderhar Inc,Gray Mangrove
Cherry Birch Pollen,pede justo lacinia eget tincidunt eget tempus vel pede morbi porttitor lorem id ligula,542354,8/18/18,9/24/25,4,12/30/19,0,3,3,12,"Hammes, Friesen and Vandervort",Koolau Range Colicwood
Ciprofloxacin,non ligula pellentesque ultrices phasellus id sapien in sapien iaculis congue vivamus metus arcu adipiscing molestie hendrerit at vulputate,679829,11/7/17,4/15/28,4,11/24/18,3,4,4,13,"Ortiz, Dietrich and Blanda",Rhizome Bluegrass
Theophylline in Dextrose,vestibulum aliquet ultrices erat tortor sollicitudin mi sit amet lobortis sapien sapien non mi integer ac,697758,1/7/17,2/27/19,2,6/14/18,0,5,5,11,Aufderhar Inc,Mcallister's Phlox
Arthritazin Pain Relieving,laoreet ut rhoncus aliquet pulvinar sed nisl nunc rhoncus dui vel sem sed sagittis nam congue risus,682063,6/6/07,6/3/11,4,9/1/10,4,6,6,12,"Hammes, Friesen and Vandervort",Paleyellow Tidytips
NovoLog,in tempus sit amet sem fusce consequat nulla nisl nunc nisl duis bibendum felis sed interdum,753823,4/18/13,4/22/17,1,11/19/16,9,7,7,13,"Ortiz, Dietrich and Blanda",Mat Vetch
Surmontil,vestibulum eget vulputate ut ultrices vel augue vestibulum ante ipsum primis in faucibus orci luctus et ultrices posuere cubilia,148630,12/12/06,4/27/13,2,12/12/07,5,8,8,11,Aufderhar Inc,Johnny-tuck
Detrol LA,suscipit ligula in lacus curabitur at ipsum ac tellus semper interdum mauris ullamcorper,152025,6/11/16,4/30/28,4,12/2/19,0,9,9,12,"Hammes, Friesen and Vandervort",American Wisteria
PREP (AND) PRIME CC COLOR CORRECT SPF30 BROAD SPECTRUM,nulla integer pede justo lacinia eget tincidunt eget tempus vel pede morbi porttitor lorem id ligula suspendisse ornare consequat,595821,8/15/13,4/12/17,3,12/8/14,8,10,10,13,"Ortiz, Dietrich and Blanda",Dense False Gilyflower
Blesbok,vel pede morbi porttitor lorem id ligula suspendisse ornare consequat lectus in est risus,953419,11/2/12,4/4/25,1,8/27/13,0,1,1,11,Klein Inc,Jared's Pepperweed
Red brocket,dolor morbi vel lectus in quam fringilla rhoncus mauris enim leo rhoncus sed vestibulum,674838,4/30/21,12/27/27,4,3/9/22,4,2,2,12,"Rowe, Crist and Beier",Bluejoint
"Deer, white-tailed",ut ultrices vel augue vestibulum ante ipsum primis in faucibus,627997,6/27/05,11/30/15,1,4/17/14,2,3,3,13,Robel-Hand,American Beachgrass
"Bandicoot, southern brown",mattis pulvinar nulla pede ullamcorper augue,652217,1/3/09,4/27/09,3,2/27/09,8,4,4,14,Wilkinson-Maggio,San Carlos Buckwheat
Greater blue-eared starling,commodo placerat praesent blandit nam nulla integer pede justo lacinia eget,504423,9/29/02,1/13/09,4,1/31/05,6,5,5,15,"Brown, Rempel and Auer",Charming Centaury
African fish eagle,consectetuer adipiscing elit proin interdum mauris non ligula pellentesque ultrices phasellus id sapien in sapien,391820,12/26/04,8/18/20017,3,7/12/16,0,6,6,16,Doyle Inc,Chisos Mountain Crested Coralroot
Plains zebra,dolor vel est donec odio justo sollicitudin ut suscipit a,714401,5/18/18,3/30/25,2,1/2/19,4,7,7,17,Mills Inc,Canadian White Violet
Red brocket,et magnis dis parturient montes nascetur ridiculus mus vivamus vestibulum sagittis,879366,10/30/06,7/24/12,1,12/27/06,10,8,8,18,Mueller-Gerhold,Lycianthes
Jaguar,aenean lectus pellentesque eget nunc donec quis,388790,1/16/16,4/17/19,1,7/31/17,3,9,9,19,Parisian-Mann,Largeflower Tickseed
"Kiskadee, great",imperdiet et commodo vulputate justo in blandit,933593,10/18/19,5/19/29,1,3/20/21,2,10,10,20,Legros-Gerhold,Hemp Agrimony
"Hornbill, southern ground",consequat dui nec nisi volutpat eleifend donec,839283,9/26/20,10/14/24,2,10/15/21,2,1,11,21,Aufderhar Inc,Tehachapi Ragwort
Wild boar,orci nullam molestie nibh in,822343,7/23/18,10/27/22,1,4/10/21,3,2,12,11,"Hammes, Friesen and Vandervort",Prairie Gentian
Asian foreset tortoise,tempus semper est quam pharetra,988639,7/26/17,9/5/26,4,10/22/17,10,3,13,12,"Ortiz, Dietrich and Blanda",Suksdorf's Buttercup
"White-eye, pale",ipsum praesent blandit lacinia erat vestibulum sed magna at nunc commodo placerat praesent,352560,9/10/08,12/31/15,1,7/21/09,9,4,14,13,Cummerata-Bahringer,Coastal Wattle
Antelope ground squirrel,varius ut blandit non interdum in ante vestibulum ante ipsum primis in,856065,3/20/08,6/24/22,2,8/24/09,6,5,15,14,Morar-Streich,Sierra Woodrush
Indian jackal,morbi odio odio elementum eu interdum eu tincidunt in leo maecenas pulvinar lobortis,680431,11/29/17,2/27/23,4,10/3/18,0,6,16,15,"Mayert, Schoen and Cremin",Straight Bladderpod
Red sheep,ipsum ac tellus semper interdum mauris ullamcorper purus sit amet nulla,470555,5/9/05,5/31/16,2,12/22/05,3,7,17,16,Lesch-Kertzmann,Oracle Oak
"Francolin, swainson's",nulla suspendisse potenti cras in purus eu magna vulputate luctus cum sociis,760211,12/5/20,5/14/27,3,3/30/21,8,8,18,17,"Bergstrom, Schoen and Feest",Sphagnum
"Wombat, southern hairy-nosed",sed justo pellentesque viverra pede ac diam,780046,1/7/17,8/6/23,1,12/9/18,7,9,19,18,Deckow and Sons,Locoto
"Parakeet, rose-ringed",fusce consequat nulla nisl nunc nisl duis bibendum felis sed interdum venenatis,901879,6/20/01,12/31/26,1,1/10/17,1,10,20,19,Walker and Sons,New Mexico Goosefoot
Native cat,justo in blandit ultrices enim lorem ipsum dolor sit,759060,5/12/14,11/26/18,2,12/20/15,0,1,21,20,Marquardt-McGlynn,Ambrosia Leaf Bur Ragweed
"Wallaby, agile",volutpat erat quisque erat eros viverra eget congue eget semper rutrum nulla nunc,880383,1/28/01,8/29/20,4,4/9/07,8,2,22,21,Connelly LLC,Gray Mangrove
"Snake, tiger",commodo placerat praesent blandit nam nulla integer pede justo lacinia eget tincidunt eget tempus,917230,6/29/17,9/25/27,2,3/29/19,8,3,23,11,Johnston-Lemke,Koolau Range Colicwood
Red lava crab,maecenas tristique est et tempus semper est quam pharetra magna ac consequat metus sapien,396500,1/25/15,3/22/17,1,3/15/16,2,4,24,12,O'Kon LLC,Rhizome Bluegrass
American badger,nullam orci pede venenatis non sodales sed tincidunt eu felis fusce posuere,216332,10/8/04,12/14/12,3,4/16/09,5,5,25,13,Jones-Berge,Mcallister's Phlox
Tsessebe,curabitur gravida nisi at nibh,603151,12/13/14,5/12/21,3,1/11/15,8,6,26,14,"Durgan, Homenick and Rowe",Paleyellow Tidytips
California sea lion,lectus in est risus auctor,540893,7/19/12,5/7/21,2,9/25/14,0,7,27,15,Beatty-Carter,Mat Vetch
Green vine snake,in felis donec semper sapien a libero nam dui proin leo odio,811767,6/30/11,4/7/19,1,3/14/12,4,8,28,16,Cummerata LLC,Johnny-tuck
"Pintail, white-cheeked",sodales sed tincidunt eu felis fusce posuere felis,507299,12/17/14,10/29/24,1,1/3/16,1,9,29,17,Kuhn Inc,American Wisteria
"Deer, mule",mattis odio donec vitae nisi nam,307785,8/12/04,8/26/06,2,10/8/05,5,10,30,18,Deckow LLC,Dense False Gilyflower
"Dove, mourning collared",orci vehicula condimentum curabitur in libero ut massa,668211,11/13/20,10/11/24,4,8/18/21,5,1,31,19,"Beahan, Hessel and Trantow",Jared's Pepperweed
Red phalarope,orci luctus et ultrices posuere,781742,10/6/12,11/3/18,3,3/2/13,8,2,32,20,Mueller-Abernathy,Bluejoint
"Legaan, ground",odio donec vitae nisi nam ultrices libero non mattis pulvinar nulla pede,123433,3/19/18,6/30/25,4,2/28/19,5,3,33,21,Greenholt-Pollich,American Beachgrass
"Starfish, crown of thorns",odio curabitur convallis duis consequat dui nec nisi volutpat eleifend,309511,7/13/08,7/27/24,4,7/21/18,2,4,34,11,Connelly-Douglas,San Carlos Buckwheat
"Phalarope, red",facilisi cras non velit nec nisi vulputate,782905,12/6/16,10/25/21,2,9/17/19,7,5,35,12,Dicki-Walker,Charming Centaury
African ground squirrel (unidentified),tincidunt eget tempus vel pede morbi porttitor lorem id ligula suspendisse,143448,6/3/20,7/3/26,1,3/6/21,10,6,36,13,Glover Group,Chisos Mountain Crested Coralroot
Two-toed sloth,pulvinar nulla pede ullamcorper augue a suscipit,444879,5/26/11,4/10/17,3,12/18/15,10,7,37,14,Dickens-Daniel,Canadian White Violet
"Cormorant, king",et tempus semper est quam pharetra magna ac consequat metus sapien ut nunc vestibulum ante,905398,12/1/18,6/19/20,1,5/9/19,2,8,38,15,"Medhurst, Raynor and Koch",Lycianthes
European beaver,potenti cras in purus eu magna vulputate luctus cum sociis natoque,456697,5/3/11,5/3/17,3,7/16/13,3,9,39,16,Zboncak Group,Largeflower Tickseed
Red and blue macaw,vestibulum ante ipsum primis in faucibus orci luctus et ultrices posuere cubilia curae mauris viverra,249468,3/30/13,10/21/19,1,2/4/14,0,10,40,17,Kessler Inc,Hemp Agrimony
Pine siskin,eget eros elementum pellentesque quisque porta volutpat erat quisque erat eros viverra eget congue,373480,11/18/08,1/31/17,2,4/7/12,5,1,1,18,Klein Inc,Tehachapi Ragwort
"Tortoise, radiated",euismod scelerisque quam turpis adipiscing lorem vitae,491776,6/20/20,7/14/26,1,8/7/21,8,1,2,19,"Rowe, Crist and Beier",Prairie Gentian
"Goose, snow",felis eu sapien cursus vestibulum proin eu mi nulla ac enim in tempor turpis nec,433644,1/10/21,6/18/28,4,11/5/21,9,2,3,20,Robel-Hand,Suksdorf's Buttercup
"Wombat, common",a feugiat et eros vestibulum ac est lacinia nisi venenatis tristique fusce congue diam id,141068,5/18/17,4/1/26,2,6/13/21,6,3,4,21,Wilkinson-Maggio,Coastal Wattle
"Lion, asian",amet eleifend pede libero quis orci nullam molestie,146435,4/21/12,2/27/15,1,2/24/14,2,4,5,11,"Brown, Rempel and Auer",Sierra Woodrush
White-winged tern,ultrices vel augue vestibulum ante ipsum primis in faucibus orci luctus,869816,4/28/02,10/16/08,1,8/30/07,7,5,6,12,Doyle Inc,Straight Bladderpod
European wild cat,velit vivamus vel nulla eget eros elementum,206061,9/28/03,7/19/07,1,4/12/06,6,6,7,13,Mills Inc,Oracle Oak
Tropical buckeye butterfly,nunc viverra dapibus nulla suscipit ligula in lacus curabitur,677021,10/14/06,6/4/14,4,1/5/11,10,7,8,14,Mueller-Gerhold,Sphagnum
Bontebok,proin at turpis a pede posuere nonummy integer non velit donec diam neque vestibulum,130522,4/23/18,6/27/26,2,4/15/20,9,8,9,15,Parisian-Mann,Locoto
"Pigeon, wood",in consequat ut nulla sed accumsan,603913,3/17/07,1/14/24,3,12/1/08,5,9,10,16,Legros-Gerhold,New Mexico Goosefoot
Great kiskadee,non quam nec dui luctus rutrum nulla,879641,7/27/05,12/28/25,4,1/28/19,10,10,11,17,Aufderhar Inc,Ambrosia Leaf Bur Ragweed
Tsakos Energy Navigation Ltd,Donec dapibus.,388501,10/8/06,11/7/13,3,4/4/07,4,1,9,11,"Hammes, Friesen and Vandervort",New Mexico Goosefoot
Union Bankshares Corporation,Nulla ut erat id mauris vulputate elementum.,927692,9/16/11,2/5/17,3,7/21/12,8,2,3,19,"Hammes, Friesen and Vandervort",Ambrosia Leaf Bur Ragweed
"IF Bancorp, Inc.",Suspendisse accumsan tortor quis turpis.,539993,5/4/02,10/2/15,4,5/28/11,3,3,12,20,"Ortiz, Dietrich and Blanda",Gray Mangrove
"Golub Capital BDC, Inc.","Donec odio justo, sollicitudin ut, suscipit a, feugiat et, eros.",646160,7/23/20,8/4/28,3,10/19/21,5,4,12,12,"Ortiz, Dietrich and Blanda",Koolau Range Colicwood
RXi Pharmaceuticals Corporation,Vestibulum ante ipsum primis in faucibus orci luctus et ultrices posuere cubilia Curae; Duis faucibus accumsan odio.,946205,12/11/09,2/25/15,2,12/9/10,8,5,11,21,Aufderhar Inc,Rhizome Bluegrass
"Lydall, Inc.",Nunc nisl.,544084,7/24/18,5/13/23,1,3/4/21,6,6,11,13,Aufderhar Inc,Mcallister's Phlox
"Cohu, Inc.",Praesent blandit.,492151,6/9/02,12/7/14,4,12/29/10,8,7,11,16,Aufderhar Inc,Paleyellow Tidytips
"XG Technology, Inc",Proin interdum mauris non ligula pellentesque ultrices.,167898,12/17/14,2/17/28,3,11/11/16,8,8,11,21,Aufderhar Inc,Mat Vetch
,,,,,,,,,,,,
"Nike, Inc.","Nulla neque libero, convallis eget, eleifend luctus, ultricies eu, nibh.",506889,10/22/06,6/22/24,4,1/12/21,1,10,1,16,Klein Inc,American Wisteria
title,desc,funds,start_date,end_sate,duration ,eval_date,evaluation ,exec_id,super_id,eval_id,org_name,prog_name
"Garden of the Finzi-Continis, The (Giardino dei Finzi-Contini, Il)",Phasellus id sapien in sapien iaculis congue.,755008,10/10/20,8/8/29,2,12/12/21,10,4,2,14,"Rowe, Crist and Beier",Jared's Pepperweed
Skhizein,"Morbi sem mauris, laoreet ut, rhoncus aliquet, pulvinar sed, nisl.",458316,10/11/20,8/9/29,2,12/13/21,8,4,2,14,"Rowe, Crist and Beier",Bluejoint
Apocalypto,In congue.,835021,10/12/20,8/10/29,1,12/14/21,9,4,2,14,"Rowe, Crist and Beier",American Beachgrass
Elvis Meets Nixon,Maecenas pulvinar lobortis est.,561716,10/13/20,8/11/29,2,12/15/21,2,4,2,14,"Rowe, Crist and Beier",San Carlos Buckwheat
Love Actually,"Integer aliquet, massa id lobortis convallis, tortor risus dapibus augue, vel accumsan tellus nisi eu orci.",344264,10/14/20,8/12/29,2,12/16/21,2,4,2,14,"Rowe, Crist and Beier",Charming Centaury
"Heartbreak Kid, The",Etiam justo.,906326,10/15/20,8/13/29,1,12/17/21,9,4,2,14,"Rowe, Crist and Beier",Chisos Mountain Crested Coralroot
Nobel Son,"Duis bibendum, felis sed interdum venenatis, turpis enim blandit mi, in porttitor pede justo eu massa.",895108,10/16/20,8/14/29,2,12/18/21,9,4,2,14,"Rowe, Crist and Beier",Canadian White Violet
Early Summer (Bakushû),In quis justo.,855703,10/17/20,8/15/29,1,12/19/21,1,4,2,14,"Rowe, Crist and Beier",Lycianthes
"Man Without a Past, The (Mies vailla menneisyyttä)",Nulla nisl.,190370,10/18/20,8/16/29,2,12/20/21,6,4,2,14,"Rowe, Crist and Beier",Largeflower Tickseed
"Yards, The",Duis ac nibh.,146062,10/19/20,8/17/29,2,12/21/21,3,4,2,14,"Rowe, Crist and Beier",Hemp Agrimony
Attack of the Mushroom People (Matango),Aliquam sit amet diam in magna bibendum imperdiet.,720348,5/5/21,8/18/29,2,12/22/21,8,4,2,14,"Rowe, Crist and Beier",Tehachapi Ragwort
Manborg,Ut tellus.,534568,5/6/21,8/19/29,1,12/23/21,5,4,2,14,"Rowe, Crist and Beier",Prairie Gentian
"Snake of June, A (Rokugatsu no hebi)","In est risus, auctor sed, tristique in, tempus sit amet, sem.",177160,5/7/21,8/20/29,2,12/24/21,10,4,2,14,"Rowe, Crist and Beier",Suksdorf's Buttercup
Five Graves to Cairo,"Proin leo odio, porttitor id, consequat in, consequat ut, nulla.",343708,5/8/21,8/21/29,1,12/25/21,6,4,2,14,"Rowe, Crist and Beier",Coastal Wattle
Benji ,Aliquam erat volutpat.,761602,5/9/21,8/22/29,2,12/26/21,10,4,2,14,"Rowe, Crist and Beier",Sierra Woodrush
Seven Ways from Sundown,Phasellus in felis.,192593,5/10/21,8/23/29,1,12/27/21,7,4,2,14,"Rowe, Crist and Beier",Straight Bladderpod
There's Always Tomorrow,Integer ac leo.,973369,5/11/21,8/24/29,2,12/28/21,9,4,2,14,"Rowe, Crist and Beier",Oracle Oak
Public Housing,Fusce consequat.,239967,5/12/21,8/25/29,1,12/29/21,9,4,2,14,"Rowe, Crist and Beier",Sphagnum
The Epic of Everest,Cras pellentesque volutpat dui.,924862,5/13/21,8/26/29,1,12/30/21,3,4,2,14,"Rowe, Crist and Beier",Locoto
"Skin Too Few: The Days of Nick Drake, A",Aliquam non mauris.,461186,5/14/21,8/27/29,2,12/31/21,9,4,2,14,"Rowe, Crist and Beier",New Mexico Goosefoot